{
  "$schema": "../docs/site-config.schema.json",
  "site": {
    "title": "Acme Coffee Roasters",
    "tagline": "Small-batch coffee, roasted with love",
    "language": "en_US",
    "timezone": "UTC",
    "url": "http://localhost:8080",
    "admin": {
      "user": "admin",
      "email": "admin@example.com"
    }
  },
  "branding": {
    "logo": "logo.svg",
    "favicon": "logo.svg",
    "colors": {
      "primary": "#6f4e37",
      "accent": "#e0a458",
      "text": "#2b2b2b",
      "background": "#fffaf3"
    },
    "fonts": {
      "heading": "Georgia, 'Times New Roman', serif",
      "body": "-apple-system, BlinkMacSystemFont, 'Segoe UI', Roboto, Helvetica, Arial, sans-serif"
    }
  },
  "contact": {
    "email": "hello@acmecoffee.example",
    "phone": "+1 (555) 123-4567",
    "address": "123 Bean Street, Portland, OR",
    "social": {
      "twitter": "https://twitter.com/example",
      "instagram": "https://instagram.com/example",
      "facebook": "https://facebook.com/example"
    }
  },
  "hero": {
    "heading": "Coffee that wakes up your soul",
    "subheading": "Ethically sourced beans, roasted fresh every morning and delivered to your door.",
    "image": "hero.svg",
    "cta": {
      "label": "Shop our beans",
      "url": "/shop"
    },
    "secondary_cta": {
      "label": "Our story",
      "url": "/about"
    }
  },
  "sections": [
    {
      "type": "features",
      "heading": "Why choose us",
      "items": [
        { "icon": "leaf", "title": "Ethically Sourced", "text": "Direct-trade beans from farmers we know by name." },
        { "icon": "fire", "title": "Roasted Daily", "text": "Every bag is roasted within 24 hours of shipping." },
        { "icon": "truck", "title": "Free Shipping", "text": "On all orders over $35, anywhere in the country." }
      ]
    },
    {
      "type": "about",
      "heading": "Our story",
      "text": "Acme Coffee Roasters started in a tiny garage in 2012. Today we roast for thousands of households, but we still treat every batch like our first.",
      "image": "about.svg"
    },
    {
      "type": "gallery",
      "heading": "From bean to cup",
      "images": ["hero.svg", "about.svg"]
    }
  ],
  "pages": [
    {
      "slug": "home",
      "title": "Home",
      "front_page": true,
      "blocks": []
    },
    {
      "slug": "about",
      "title": "About",
      "content": "<p>We are a small team obsessed with great coffee. Learn more about our roasting philosophy and the farmers we partner with.</p>"
    },
    {
      "slug": "shop",
      "title": "Shop",
      "content": "<p>Browse our current selection of single-origin and blended coffees.</p>"
    },
    {
      "slug": "contact",
      "title": "Contact",
      "content": "<p>Have a question? Reach out and we'll get back to you within one business day.</p>"
    }
  ],
  "menus": {
    "primary": [
      { "title": "Home", "page": "home" },
      { "title": "About", "page": "about" },
      { "title": "Shop", "page": "shop" },
      { "title": "Contact", "page": "contact" }
    ],
    "footer": [
      { "title": "About", "page": "about" },
      { "title": "Contact", "page": "contact" }
    ]
  },
  "posts": [
    {
      "title": "Welcome to our new website",
      "content": "<p>We just launched our brand new site. Take a look around and let us know what you think!</p>",
      "category": "News"
    },
    {
      "title": "How we pick our beans",
      "content": "<p>A behind-the-scenes look at how we travel the world to find the perfect coffee beans.</p>",
      "category": "Stories"
    }
  ],
  "plugins": []
}
